{
  "schema": "decrypt.target-profile.v1",
  "id": "lume-arm64-qualification",
  "kind": "qualification",
  "arch": "aarch64",
  "hypervisors": [
    "apple"
  ],
  "vmName": "decrypt-qualify",
  "hostname": "decrypt-qualify",
  "user": "customer",
  "disk": {
    "device": "/dev/vda",
    "bytes": 42949672960
  },
  "partitionNaming": "suffix",
  "liveRoot": {
    "allowedFsTypes": [
      "tmpfs",
      "ramfs",
      "rootfs",
      "overlay",
      "squashfs",
      "btrfs"
    ],
    "requireRamBacked": true
  },
  "kernelPackage": "linux-aarch64",
  "basePackages": [
    "base",
    "base-devel",
    "linux-aarch64",
    "linux-firmware",
    "archlinuxarm-keyring",
    "btrfs-progs",
    "dosfstools",
    "efibootmgr",
    "git",
    "networkmanager",
    "sudo",
    "python",
    "nftables",
    "ca-certificates",
    "curl"
  ],
  "desktopPackageList": "installer/desktop-packages.txt",
  "network": {
    "phaseA": "offline",
    "phaseB": "offline",
    "policyId": "image-factory-offline-v1"
  },
  "logChannel": {
    "kind": "log-disk",
    "label": "DECRYPT_LOG",
    "uuid": null
  },
  "graphics": {
    "policy": "lume-software-v1",
    "softwareRendering": true
  },
  "password": "native-prompt",
  "notice": "profile-accepted"
}
